{
  "id": "cozy_chat",
  "name": {
    "en": "Cozy Chat",
    "ja": "まったり雑談",
    "id": "Ngobrol Santai"
  },
  "description": {
    "en": "Gentle drift and a warm grade for chatting.",
    "ja": "ゆったり揺れる暖かい雑談ルック。",
    "id": "Gerakan lembut dan warna hangat untuk ngobrol."
  },
  "pro": false,
  "tags": [
    "chat",
    "drift",
    "warm"
  ],
  "roles": {
    "bg": 3,
    "char": 1,
    "fg": 0.6
  },
  "auto": {
    "mode": "drift",
    "intensity": 0.35
  },
  "fx": "cozy",
  "audio_react": {
    "amount": 0.25,
    "attack_ms": 30,
    "release_ms": 250
  },
  "dof": {
    "focus_depth": 1,
    "amount": 0.2
  },
  "overscan": 0.08
}
